Enter password: ********
Welcome to the MySQL monitor.  Commands end with ; or \g.
Your MySQL connection id is 25
Server version: 8.0.28 MySQL Community Server - GPL

Copyright (c) 2000, 2022, Oracle and/or its affiliates.

Oracle is a registered trademark of Oracle Corporation and/or its
affiliates. Other names may be trademarks of their respective
owners.

Type 'help;' or '\h' for help. Type '\c' to clear the current input statement.

mysql> show databases;
+--------------------+
| Database           |
+--------------------+
| information_schema |
| mysql              |
| payroll_service    |
| performance_schema |
| sys                |
+--------------------+
5 rows in set (0.03 sec)

mysql> creat database testdb;
ERROR 1064 (42000): You have an error in your SQL syntax; check the manual that corresponds to your MySQL server version for the right syntax to use near 'creat database testdb' at line 1
mysql> create database testdb;
Query OK, 1 row affected (0.05 sec)

mysql> show databases;
+--------------------+
| Database           |
+--------------------+
| information_schema |
| mysql              |
| payroll_service    |
| performance_schema |
| sys                |
| testdb             |
+--------------------+
6 rows in set (0.00 sec)

mysql> drop database testdb;
Query OK, 0 rows affected (0.06 sec)

mysql> create database payroll_services;
Query OK, 1 row affected (0.02 sec)

mysql> show databases;
+--------------------+
| Database           |
+--------------------+
| information_schema |
| mysql              |
| payroll_service    |
| payroll_services   |
| performance_schema |
| sys                |
+--------------------+
6 rows in set (0.00 sec)

mysql> use payroll_services;
Database changed
mysql> select database();
+------------------+
| database()       |
+------------------+
| payroll_services |
+------------------+
1 row in set (0.00 sec)

mysql> create table employee_payroll
    -> (
    -> id          INT unsigned not null auto_increment,
    -> name        varchar(150) not null,
    -> salary      double not null,
    -> start       date not null,
    -> PRIMARY KEY (id)
    -> );
Query OK, 0 rows affected (0.12 sec)

mysql> describe employee_payroll;
+--------+--------------+------+-----+---------+----------------+
| Field  | Type         | Null | Key | Default | Extra          |
+--------+--------------+------+-----+---------+----------------+
| id     | int unsigned | NO   | PRI | NULL    | auto_increment |
| name   | varchar(150) | NO   |     | NULL    |                |
| salary | double       | NO   |     | NULL    |                |
| start  | date         | NO   |     | NULL    |                |
+--------+--------------+------+-----+---------+----------------+
4 rows in set (0.03 sec)

mysql> insert into employee_payroll ( name, salary, start) values
    -> ( 'bill', 100000.00, '2018-01-03')
    -> ( 'Terisa', 200000.00, '2020-05-21')
    -> ( 'Avinash' 150000.00, '2022-03-31');
ERROR 1064 (42000): You have an error in your SQL syntax; check the manual that corresponds to your MySQL server version for the right syntax to use near '( 'Terisa', 200000.00, '2020-05-21')
( 'Avinash' 150000.00, '2022-03-31')' at line 3
mysql> insert into employee_payroll ( name, salary, start) values
    -> ( 'bill', 100000.00, '2018-01-03')
    -> ( 'Terisa', 200000.00, '2020-05-21')
    -> ( 'Avinash', 150000.00, '2022-03-31');
ERROR 1064 (42000): You have an error in your SQL syntax; check the manual that corresponds to your MySQL server version for the right syntax to use near '( 'Terisa', 200000.00, '2020-05-21')
( 'Avinash', 150000.00, '2022-03-31')' at line 3
mysql> insert into employee_payroll ( name, salary, start) values
    -> ( 'bill', 100000.00, '2018-01-03'),
    -> ( 'Terisa', 200000.00, '2020-05-21'),
    -> ( 'Avinash', 150000.00, '2022-03-31');
Query OK, 3 rows affected (0.03 sec)
Records: 3  Duplicates: 0  Warnings: 0

mysql> select * from employee_payroll;
+----+---------+--------+------------+
| id | name    | salary | start      |
+----+---------+--------+------------+
|  1 | bill    | 100000 | 2018-01-03 |
|  2 | Terisa  | 200000 | 2020-05-21 |
|  3 | Avinash | 150000 | 2022-03-31 |
+----+---------+--------+------------+
3 rows in set (0.00 sec)

mysql> select salary from employee_payroll where name = 'bill';
+--------+
| salary |
+--------+
| 100000 |
+--------+
1 row in set (0.01 sec)

mysql> select * from employee_payroll
    -> where start between cast ('2018-01-01' as date) and date (now());
ERROR 1584 (42000): Incorrect parameters in the call to stored function `cast`
mysql> select * from employee_payroll
    -> WHERE start BETWEEN CAST ('2018-01-01' AS DATE) AND DATE (NOW());
ERROR 1584 (42000): Incorrect parameters in the call to stored function `CAST`
mysql> SELECT * FROM employee_payroll
    -> WHERE start BETWEEN CAST ('2018-01-01' AS DATE) AND DATE (NOW());
ERROR 1584 (42000): Incorrect parameters in the call to stored function `CAST`
mysql> select * from employee_payroll
    -> where start between cast('2018-01-01' as date) and date (now());
+----+--------+--------+------------+
| id | name   | salary | start      |
+----+--------+--------+------------+
|  1 | bill   | 100000 | 2018-01-03 |
|  2 | Terisa | 200000 | 2020-05-21 |
+----+--------+--------+------------+
2 rows in set (0.01 sec)

mysql> ALTER TABLE employee_payroll ADD gender CHAR(1) AFTER name;
Query OK, 0 rows affected (0.09 sec)
Records: 0  Duplicates: 0  Warnings: 0

mysql> describe employee_payroll;
+--------+--------------+------+-----+---------+----------------+
| Field  | Type         | Null | Key | Default | Extra          |
+--------+--------------+------+-----+---------+----------------+
| id     | int unsigned | NO   | PRI | NULL    | auto_increment |
| name   | varchar(150) | NO   |     | NULL    |                |
| gender | char(1)      | YES  |     | NULL    |                |
| salary | double       | NO   |     | NULL    |                |
| start  | date         | NO   |     | NULL    |                |
+--------+--------------+------+-----+---------+----------------+
5 rows in set (0.01 sec)

mysql> update employee_payroll set gender = 'F' where name = 'Terisa';
Query OK, 1 row affected (0.01 sec)
Rows matched: 1  Changed: 1  Warnings: 0

mysql> select * from employee_payroll
    -> ^C
mysql> select * from employee_payroll;
+----+---------+--------+--------+------------+
| id | name    | gender | salary | start      |
+----+---------+--------+--------+------------+
|  1 | bill    | NULL   | 100000 | 2018-01-03 |
|  2 | Terisa  | F      | 200000 | 2020-05-21 |
|  3 | Avinash | NULL   | 150000 | 2022-03-31 |
+----+---------+--------+--------+------------+
3 rows in set (0.00 sec)

mysql> update employee_payroll set gender = 'M' where name = 'Terisa' or 'Avinash';
ERROR 1292 (22007): Truncated incorrect DOUBLE value: 'Avinash'
mysql> update employee_payroll set gender = 'M' where name = 'Terisa' or name = 'Avinash';
Query OK, 2 rows affected (0.01 sec)
Rows matched: 2  Changed: 2  Warnings: 0

mysql> select * from employee_payroll;
+----+---------+--------+--------+------------+
| id | name    | gender | salary | start      |
+----+---------+--------+--------+------------+
|  1 | bill    | NULL   | 100000 | 2018-01-03 |
|  2 | Terisa  | M      | 200000 | 2020-05-21 |
|  3 | Avinash | M      | 150000 | 2022-03-31 |
+----+---------+--------+--------+------------+
3 rows in set (0.01 sec)

mysql> update employee_payroll set gender = 'F' where name = 'Terisa';
Query OK, 1 row affected (0.01 sec)
Rows matched: 1  Changed: 1  Warnings: 0

mysql> update employee_payroll set gender = 'M' where name = 'bnill' or 'Avinash';
ERROR 1292 (22007): Truncated incorrect DOUBLE value: 'Avinash'
mysql> update employee_payroll set gender = 'M' where name = 'bill' or name = 'Avinash';
Query OK, 1 row affected (0.01 sec)
Rows matched: 2  Changed: 1  Warnings: 0

mysql> select * from employee_payroll;
+----+---------+--------+--------+------------+
| id | name    | gender | salary | start      |
+----+---------+--------+--------+------------+
|  1 | bill    | M      | 100000 | 2018-01-03 |
|  2 | Terisa  | F      | 200000 | 2020-05-21 |
|  3 | Avinash | M      | 150000 | 2022-03-31 |
+----+---------+--------+--------+------------+
3 rows in set (0.00 sec)

mysql>